22,1,b'This classic has so many great one-liners and unintentionally hilarious scenes that I don\'t even know where to start. If you want advice on dating, its here. Just totally ignore the person you want, and then spout out classic lines like "Chicken\'s good...I like Chicken", and before you know it you will be having a one-nighter in a basement (it\'s a NICE basement) with a woman who is 35 years younger than you. Bronson does it all in this film. He buys a car for no good reason just so he can murder two gang members...paying with "CASH"......chunnng.... He buys an ice cream, simply because "this is America, isn\'t it", and ends up wasting someone named "the giggler - he laughs when he runs" just because he stole his camera. By the way, this "giggler" is so fast that Bronson\'s regular pistol can\'t even catch up to him, he needs to order a special one just to get this elusive creep. He gets cleaned up just so he can eat a REALLY smelly meal (stuffed cabbage) in a rat trap with a couple of old people who like to wear heavy clothing in 90 degree weather. He goes into the dentistry business. He always seems to find a crow bar when he needs one (and its the same one!). And last, but not least, he always seems to have a rocket launcher at his disposal just in case he needs to blow away Richie Cunningham\'s older brother Chuck who is now strung out and in dire need of a makeover. Anyway, this will all make sense once you have seen this classic...all I can say is enjoy! "I owed you that one DUDE"'
23,0,b"What to say about this movie? A married couple has more then just each other. After playing around for some time things gets more serious. A difficult choice has to be made: continue the old situation or start all over by following the heart. Guess what happens at the end. <br /><br />This movie seems to be very low budget. But a good story don't have to be expensive. It looks like a play that has been converted to a movie only by using several cheap locations (at least very little other people visible) more than just the stage, in this one the house. From the first minute future developments are clear as water. Nothing unexpected happens. Sometimes you may think watching a soft porn movie, in which case you know in advance that there's no story. <br /><br />I find this movie disappointing so that's explains the vote (4)."
24,0,b'It\'s so fake! The plot seems like a generic adaptation of the average blaxploitation film. The common themes of blaxploitation like racism, oppression and fighting for the integrity of your community are outlined so simplistically/shallowly. And the jokes aren\'t even funny! Dolemite does these stand up monologue comedy routines that are really painful. All the people around him deliver this canned laughter. Even the soundtrack sounds like it\'s fakin\' the funk. For far better comedy in a blaxploitation try "Coffy" & "Friday Foster" with Pam Grier. For a more realistic blax experience try "Black Heat".'
25,1,b"I first saw this movie on IFC. Which is a great network by the way to see underground films. I watched this movie and was thinking it was going to be pure drama and a story line that doesn't hold water. But it really was a worth while watch. The main character is in such rough shape, and you hate to see him deny help, but no matter what you just can't hate him. His devotion to The Beatles and John Lennon is a great metaphor for his life and the helplessness he feels. <br /><br />The atmosphere of the film is also great. At times, you feel like you can see what he sees, feel what he feels in some situations. This movie does not leave you wanting to know more, or disliking a loophole in the plot. There are NO loopholes (in my opinion). I have always been a fan of foreign films, especially now with movies being made so poorly in America. I really enjoy the foreign settings because I feel it can take you on a trip, and sometimes understand a different culture. This movie did all those things to me and more. Please watch this movie and if you're new to foreign films, this is a great start."
26,1,b"as a former TV editor, I can say this is as authentic as it gets. It even led to Letterman's producer (thought to be a source) resigning (eventually) in real life. Letterman was outraged (OK, so one goofy thing is it has him throwing softballs at a tire swing on his estate; total fabrication) but the main information is hilariously true, from the silly bidding war for Letterman once he decided to leave NBC to Leno's problems with an agent who was not ready for big time, but who he let run the show (almost to a disastrous exit) out of his famed loyalty. If any of you kids don't grasp the idea of why Letterman is jealous to this day, see this tape."
27,0,b'It is such a shame when actors and actresses of high quality get involved with pure crap, probably because they were offered a great deal of money. Not one of Helen Mirren\'s better career moves. The acting of the "teens" is simply appalling, not helped by a script that is in parts simply inept.<br /><br />Most of Kevin Williamson\'s work is above average box office dross, but this is really below par. <br /><br />This is the sort of movie that you watch on TV when there is nothing better on and you have had half a bottle of wine to drink and are waiting for the Pizza to be delivered so you can drink the other half.'
28,0,b"At it's core, this is a fairly typical revenge Western, heavy on the spaghetti, and if you follow it as such, the protagonist comes through successfully defeating the main villain. However there's so much going on that has no bearing on the story that you have to wonder what the film makers were thinking about. I'm referring to stuff like the way Miss Rosie's singing number just pops up out of nowhere and the boxing match in the middle of town. OK, they have a loose connection to the influence villain Mash Flanagan has, but why all of a sudden does he turn up with an alias - Mr. Donovan.<br /><br />On the flip side, I thought it was pretty innovative how the camera shot showing the wounded Wallach's view of the trail might have been filmed by someone with an actual bullet in his shoulder. And wasn't it great the way Donovan's girl uses the old headache routine when he gets a little frisky? Don't let me forget either the great stunt work by the gravel pit bad guys as Wallach guns them down as part of the finale.<br /><br />Still, there was one thing unaccounted for, and I kept waiting the entire movie for it. Whatever happened to that trio of hoods that Flanagan/Donovan hires near the start of the picture? You know, the guy Martel that a funeral parlor wanted to hire for his gun prowess, the devil's henchman Mitchell with the rifle, and the knife thrower Lincoln Tate. Each had a five thousand dollar bounty on his head, and they were supposed to protect Donovan from the guy who survived the massacre of the opening scene. They were never heard from again! I like to think that maybe Donovan just had them killed and kept the 15K all for himself."
29,0,b'I gave Soul Plane the benefit of the doubt and thought there would actually be something of comedic value in it. Im not black, but that does not mean I cant appreciate black comedy. I know that because I happen to enjoy watching the Wayans Bros, Good Times and other series. <br /><br />I\'ve seen crap movies and Im not easily repulsed. As for Soul Plane, I didn\'t even bother finishing it. Don\'t know if they managed to land the plane and I couldn\'t care less. It would be unfair to say I didn\'t find some parts funny as I did laugh, but I also laugh at Youtube videos of skateboarders falling on their nuts so that doesn\'t say much. The men in the movie were like a bunch of howling horny hyenas in mating season looking to "get some" whenever and where ever possible. And we wonder why all those stereotypes don\'t seem to disappear. To summarize: Soul Plane makes the Harold and Kumar series look like The Godfather.'
30,1,b'Whenever Hayao Miyazaki does the "tri-fecta," (writes, directs, and animates a movie) he makes a classic film for the ages. He has done it again with Gake no ue no Ponyo.<br /><br />The story is about a girl fish who is kept on a very tight leash along with her younger sisters by her father, a bitter ex-human wizard named Fujimoto. The fish escapes from her father and rides a jellyfish to shore, where she is caught up in a dredging operation and finds herself stuck in a bottle. This underwater sequence must be one of the most elaborately drawn animated scenes ever undertaken and stands on its own as a reason to search out the theatrical release. Miyazaki, who shows no fear of having a busy scene, has outdone himself. There were literally hundreds of individually-drawn sea creatures of every imaginable size all in motion at the same time.<br /><br />When the fish escapes the dredging operation while still trapped in the bottle, a five-year old boy named Sousuke spots her in the water and is able to break the bottle, saving her. Since she is the result of her father\'s magic, she is capable of magic herself--and her father actively tries to retrieve her. The boy names the fish Ponyo. Just when Sousuke learns that Ponyo can speak, her father successfully retrieves her back into captivity.<br /><br />After a war of wills with her father, Ponyo manages to escape again with the ability to change herself into a human. She meets up again with Sousuke in a storm and the story continues from there in many interesting ways. There is a cuteness factor in this film rivaling and arguably surpassing that of Tonari no Totoro. Joe Hisaishi, once again, provided outstanding musical support.<br /><br />The story itself is simple--as are Miyazaki\'s films in general--and should appeal to a broad spectrum of viewers. While I haven\'t viewed it enough to be sure, the film doesn\'t seem to be one which will keep scholars in long discussions as Sen to Chihiro no Kamikakushi did. Nonetheless, this is the ultimate feel-good entertainment movie. I gave the movie a ten out of ten rating.'
31,1,b'Well, I have to disagree with Leonard Maltin on this animated short. He loves it and claimed it was hilarious. I enjoyed it but didn\'t see any humor. He doesn\'t even like hockey or know anything about it, and still loved the story. Living right across the border from Canada, I have watched hockey for 50 years both there and in Buffalo....but I didn\'t think much of this cartoon. Oh, it was interesting and I know what would happen if you wore a Toronto jersey up in the Quebec area - disaster! That especially holds true in the glory years of Les Canadians. However, that doesn\'t make the story funny. <br /><br />Back in the 1950s, everyone in the Quebec provinces idolized the Montreal Canadians and their star player, Maurice Richard, and everyone wanted to be like him. When his mother orders a new sweater, it has the Toronto Maple Leafs emblem on it, so the kid doesn\'t want to be caught dead wearing it.. When he finally does and heads to the local rink, he gets ostracized from the rest of his hockey buddies. What\'s so funny about that? I could see the same thing happening to a kid in Boston who is Red Sox die-hard and his mom gets him Yankees shirt! Horrors! You couldn\'t wear it, and vice-versa.<br /><br />Maybe to someone who doesn\'t follow sports at all, like Maltin, this situation seems odd and humorous to him...but it\'s a fact of life or any bit-time sports fan and his favorite team. It was an interesting story, and totally believable, but nothing that made me laugh.<br /><br />The art was fun to look at throughout, almost like looking at a long series of crayon paintings done by a talented school kid. The French Canadian accent was good, too. This movie was part of the DVD "Leonard Maltin\'s Animation Favorites From The National Film Board Of Canada.'
32,1,b"I saw this movie at a screener and its the best movie I have seen in a loooong time. I loved it!!!! James Franco is sooo hot and him and Sienna Miller make the perfect couple. I don't want to give away what happens but they play a pair of newlyweds who go off on their honeymoon to Niagara Falls and some pretty wild stuff happens along the way....The movie is really really funny and sad and original. I can't even say what it reminded me of, but go see it! I cried so hard but really loved it and wanna see it again as soon as it comes out! My friends cried too. I hope it comes out soon - does anyone know when? i would really go see it if i were you"
33,1,b'You know the saying "Curiosity Killed The Cat"? Well, I have heard so much about this film, from a magazine that named this one of the most shocking movies of all time, my 1001 movies you must see before you die, my sister who saw this at a film festival, and the I love the 70\'s show on VH1. I just had to see this movie since it was named the grossest movie of all time, and well, after viewing this film last night, I have to say that it really did live up to it\'s title. My God, this movie was so weird! I thought I really did see it all with some of the sickest movies and TV shows I\'ve seen, some things I guess will always still feel like a shock.<br /><br />Well, Babs Johnson, aka Divine, has been named the filthiest person alive and a jealous couple named the Marbles are competing for that title. They want to take Divine out and be named the filthiest couple alive by kidnapping women, raping them, impregnating them, and selling their babies to lesbian couples. But it seems like Divine and her family of well... I don\'t know, seems to keep the title by having sex with chickens, butt lip syncing, eating dog feces, stuffing meat up their skirts, incest, and it just gets grosser and grosser.<br /><br />Pink Flamingos is horribly acted, horribly made, and well, just plain horrible. The reason for the 10 rating I\'m going to give it is due to the fact, well, how could you rate this film? I always rate, so I just figure what the heck? Through the grossness of this film, you have got to give John Waters some credit, who the heck would ever think of this movie over 35 years later? To the cast and crew who worked on this film, you guys are just plain nasty!<br /><br />10/10'
34,1,b"Finally! Other people who have actually seen this show! It is the funniest anime I have ever seen, but most people have even heard about it. It is just hilarious. 'And so kintaro will continue to ride his trusty bike and maybe one day, he will save the world....or maybe not'. tare just some classic bits in it 'and so he will ride onto the next city...because he has no choice since his brakes are broken (study study study)' And some of the lessons that he writes down in his little notebook, 'today i had a very educational experience. I tried to look backwards, but unfortunately I was already looking that way. It hurt. Todays lesson, the human head cannot turn 360 degrees.'"
35,0,b'The premise is interesting and the cast does the best it can, but the script and the directorial effort are so poor that it is not surprising that this film was buried--which is fitting given the screenplay. As I watched this, I could not decide which was worse, the screenplay, or the directing. The actors are over the top, the art direction looks like a Disney movie, the music is contrived, and the sentiment so sweet that it gives viewers cavities. It\'s a bad attempt to imitate "FOur Weddings And A funeral". If one wants to watch comedy that is as flat as a pancake and how poor direction can turn a story into cavity sweetness, this is a good one to watch.'
36,1,b"The Andrew Davies adaptation of the Sarah Waters' novel was excellent. The characters of Nan and and Kitty were superbly portrayed by Rachael Stirling and Kelley Hawes respectively. The whole series was a total joy to watch. It caught the imagination of everyone across the board, whether straight or gay. I wish there could be a sequel!"
37,1,b"I just checked out Northanger Abbey from the local library, and wasn't expecting much. Imagine my suprise at this gothic treat! Northanger Abbey is one of the most eerie places that you have ever seen, with empty passageways and ornate rooms full of hidden secrets. The glory of the movie is that it never reveals all: your imagination runs free, running with the imagination of the main character, one Kathrine M. She is a girl of wild imaginations, a reader of gothic fantasy that she brings into her (and our) real world.<br /><br />If I were to use one word to describe this excellent movie, it would be surrealistic. Dreams are woven throughout the movie, enhancing the mood. Sometimes, it is hard to tell what is real and what is not; this is intentional, I believe.<br /><br />Atmosphere reigns supreme. The music is not what you'd expect of a movie by Jane Austen: it is eerie, flute and drum based, high and haunting with an undercurrent of fear. If a soft, pleasant tune were playing in Northanger Abbey, it would be positively inviting. Now, it is foreboding, a grim and stark-walled palace of madmen. (But! The characters! You shall have to see them for yourself!)<br /><br />If you are looking for a most enjoyable evening, look no further than Northanger Abbey."
38,0,b"Chupacabra: Dark Waters has to rank as one of the most insipidly moronic movies ever made. I had expected at least some passable entertainment because John Rhys Davies was involved, and after seeing this movie, I can honestly say I lowered my opinion of Mr. Davies substantially.<br /><br />Why? The acting is incredibly poor. An excellent actor like Davies should have demanded more from the cast and the director. It was painfully obvious that Mr. Davies was just clock-watching and hoping the check would not bounce. To say that he just showed up would be an understatement. But at least he did show up. The rest of the cast looks like they mailed it in from their respective jobs at the various Los Angeles restaurants where they work as waiters. Talk about a cast of unknowns! This is the kind of cast that never appears in movies again. They act as if they were auditioned while waiting at the unemployment office.<br /><br />What about the special effects? Store bought firecrackers, Styrofoam, a cheap rubber suit and CGI effects that look like they came from my 1980 Atari Game. I have seen some horrible special effects used on Sci-Fi Channel movies, but this stuff looked like cut-and-paste done at the kindergarten by someones' child. I expected Mr. Crabs and Sponge-Bob would show up at the end to battle the Chupacabra. Not to mention that all the accounts of the creature describe it as a small gremlin-like critter. It would have been a good film for a Leprechaun-like character. Instead, we get a gigantic hulking creature that is shown walking with stop-action speeded-up effects that are laughable. The chupacabra is in one place and then it shuffles at super-speed down the hall and it is worth a few laughs just to see this."
39,0,b"Just saw this film at the Fantasy Filmfest BERLIN. i am not impressed.<br /><br />As far as the story goes. Too girlfriends return from their Mexico vacation. While waiting for their luggage they get to know a couple of boys, who then take the last and of course wrong shuttle bus to the city. On board is also one other older man, so weirdly portrayed that you instantly guess that he is one of the bad guys. The other one is the driver.<br /><br />The shuttle takes them into industrial wasteland and then one after the other goes done, a little blood, some cut of extremities, some violence, mostly playing with the fear of the girls In the end after some ups and downs, heres and there's, some not too new scary moments, everyone is dead but the driver and the girls. the girls end up in some garage, where one of them is killed, after confessing that she had slept with the other girlfriends boyfriend. The other girl, which is the conclusion, is sold by the left-over kidnapper (yep, weirdo got killed) in some cargo box to asia (a freight harbor being the final picture.) First. Story. Tons of loopholes, questions you ask yourself, loose ends, and a conclusion that is not a good revelation, but a total disappointment. I can't see how such a unprofessional looser is supposed to have abducted dozens of women (as is indicated by a drawer full of drivers licences...aha) Second. Acting. Mediocre at its best.<br /><br />Third. Scare Factor. OK. but I AM BoRED by torture as a means to nothing but itself. Trade with humans could be a good reason for a horror flick, but it's not used as one, just as a background.<br /><br />Fourth, Music and Sound. Some nice tries, but the sound possibilities of the industrial landscape, warehouse garage, and truck sounds have not been really explored. Music? Would have been worse without it, but apart from that. Some pseudo moving synth string theme for emotionality when the girls reach their final destination. OK, I guess.<br /><br />Verdict: AVOID IT!"
40,0,b'I watched this movie about six years ago and I recently did so again. If I remember correctly I did not like it at all the first time and I appreciated it slightly more this second time.<br /><br />This movie is obviously on a big budget. The effects are mostly top notch (except for one or two "impacts") and the cast is impressive. However, there are some elements that destroy the overall impression of the show.<br /><br />Firstly, whoever decided that Peter Stormare should act as a crazy Russian astronaut should be fired. Being a Swede and a fan of Peter, I\'m pretty sure he can play a Russian character well. But his performance in this case is plain stupid, both with respect the lines uttered and the acting. So... something must be wrong with the script. I\'d like to see Peter as a professional Russian astronaut instead.<br /><br />Secondly, the action scenes that take place on the surface are so intense that it is nearly unbearable to watch. It is a total chaos that lasts over thirty minutes with too few moments to catch one\'s breath. In addition to this, the events that unfold are simply not credible. I\'d like to see a much more sensible and stripped down version of this part of the movie.<br /><br />Finally, the scenes that involve flying space shuttles are too action-biased. The shuttles are maneuvering like if they were a couple of MIGs, at zero safety distance, while bouncing off car-sized ice blocks like ping-pong balls. The director should watch Apollo 13 to learn the limitations of spacecraft like these.<br /><br />I like the music score because it is dramatic to a degree making it very touching. The overall performance of the actors is great. Apart from the things mentioned above the story is interesting and quite easy to follow.<br /><br />With some minor changes this would have been a 8/10 movie. I\'m sorry it isn\'t!'
41,1,b'This game is not exactly the best N64 game ever. Sure, it\'s good, but only when there\'s 4 players. Without 4 players, the only fun thing to do is take remote mines and see how many people you can kill. But half of this game are levels where you have to save Natalya, so you\'ll have to limit your use of remote mines in those levels, and that gets quite boring. The graphics don\'t exactly reach the level of Super Mario 64 or even Mario Kart 64. And if you\'re talking a great multiplayer in a 1st-person shooter, you\'ll have to go with Perfect Dark. At least you can play "multiplayer" by yourself.'
