65,0,b"I was supremely disappointed with this one. Having just read the wonderful Oscar Wilde story, I had hoped for at least a little of the magic to translate onto the screen. Well, there was none. This version played like a condensed, dumbed down Reader's Digest movie. Not only did it feel rushed, it was cheapened and needlessly re written. Major characters and plot points were either changed or completely removed. I appreciate the difficulties in trying to bring a novel to the screen, especially on what may very well have been a limited (TV) budget, but there is no excuse for mangling a great story in this way. I thoroughly recommend reading Wilde's tale of the depravity that exists under even the most beautiful exteriors. But I cannot advise anyone to rent this travesty."
66,0,b'this movie is so bad. but its so bad that i was laughing my ass off. for people that like movies, do not watch this one. for people who like movies good and bad, i recommend this one. the story lines shaky,the script is horrible,the acting is horrible to mediocre. the soundtrack throughout the movie was corny but i loved it. the cool catchphrases were a plus tho. ha ha. "if it can bleed, it can die". the fight scenes cracked me up. it seemed to me like they spent more time on those parts than any other cuz the fight scenes for the most part were pretty clean. i almost feel like this movie could have been good if it weren\'t for the f/x....no it would have still been a crapshoot. the eye thing was corny. and how the chick was eating the guys stomach in the kitchen,they coulda done something where shed be actually eating something or at least put more of the fake blood on her face. and the lighthouse explosion disappointed me. i thought they might have gotten real fire instead of crappy computer synthesized stuff. and the ending was so predictable, which surprised me when they actually did what i though they might do. so overall. id say this is a classic as far as crappy movies go. its in my bottom 5.'
67,0,b'Nothing I dislike more than a kung-fu movie that plays for laughs. It is the main reason I can\'t stand Jackie Chan (or his lookalikes). He was not always a clown, I must add. "My Young Auntie" is slapstick martial arts of the worst kind. It is a perfect example of how the subgenre was brought down to the mud by endless silly antics and childish behavior. Unless you are 5-year-old, I really don\'t understand how anyone could find this kind of film funny. But humor is indeed a very subjective thing. Personally, I think this type of approach did permanent damage to the beloved subgenre. I did think leading lady Kara Hui was very good here. But I had such a hard time sitting through this one that I could not enjoy her fine performance. If you don\'t mind all the silliness, you might enjoy it. I know I didn\'t.'
68,1,b'Count Laszlo (Ralph Fiennes) has just been transferred to a hospital in Italy during World War II. He is horrifically burned from an ambush. His nurse Hana (Juliette Binoche) tends to him, body and mind, for she fears, quite rightly, that he may be a very troubled soul. In the course of his care, the Count starts to tell Hana of his recent past. It seems he worked in a government capacity in Africa, where he met a beautiful married lady named Katherine (Kristin Scott Thomas). Although they tried to avoid each other, they fell in love. After a brief affair, Katherine called it quits, leaving the Count desolate. Even so, the two would meet again, under heart-wrenching circumstances. Meanwhile, Hana herself falls for a Sihk man in the British bomb squad. Yet, the war is raging relentlessly. Can love exist when the world is in turmoil? This is a tremendous film, based on an equally fine but complex novel. The plot has many story lines that are woven together beautifully, each of them poignant beyond description. The script itself is elegant and contains many memorable lines. Fiennes is magnificent, both as the burn victim and as the man who thought love was a myth. Scott Thomas is also quite fine as the woman who fights against her passions. As for Binoche, she richly deserved the Oscar that she was presented, as her nurse is a shining example of hope in a hopeless situation. The scenery is utterly gorgeous, as are the costumes, the direction, and the production. If you have missed out on viewing this film, rectify that soon, very soon. The English Patient will remain one of the greatest achievements in film for centuries to come.'
69,1,b'I saw this movie in its brief run in "art house" cinema in \'69. I found it so funny that I literally spent part of the movie on the floor, having laughed so hard I fell out of my seat. In retrospect, years later, I thought it had been done by Melvin Van Peebles. When I mentioned it to a friend, he said that a friend of his, Downey Sr., filled virtually every non-acting role in the flick: Director, writer producer, etc. He was right of course, and my memory was wrong, except that this WAS one of the funnies movies ever made. The part of "the Arab" was particularly priceless.'
70,0,b'Role-reversal remake of 1942\'s "The Major and the Minor" has Jerry Lewis stepping into the part originally played by Ginger Rogers, but unfortunately this anemic outing is missing a lot more than just Ginger. Lewis attempts to pass for a child when boarding a train; he\'s successful, but the deception leads to a string of comic and romantic confusions. Sidney Sheldon adapted the screenplay, tossing in musical moments for Dean Martin (playing yet another in his stable of second-bananas) and a jewel-robbery subplot (which is dire). Diana Lynn, who played the wily teenager in the original film, plays Lewis\' love-interest here. She\'s cute; Jerry isn\'t. *1/2 from ****'
71,0,b'On this site I\'ve often lambasted the Americans for not knowing how to write comedy, BUT, while they\'ve never produced anything of the quality of \'Fawlty Towers\', \'Blackadder\' or \'The Fall and Rise of Reginald Perrin\', they have also never (to my knowledge) made anything as bad as this: the nadir of British comedy.<br /><br />On my Richter scale of comic awfulness, it rates only behind the truly execrable \'Are You Being Served\' as the worst comedy show in the English language, with bad acting, annoying characters and humour that I\'d grown out of before I left primary school. Unfortunately, it was part of a large crop of shows back then, along with \'Dad\'s Army\', \'It ain\'t Half Hot Mum\' and \'Allo, Allo\' that relied on ridiculous situations and familiar catch-phrases to keep audiences "amused".<br /><br />Michael Crawford proved later on that he\'s a talented performer, but personally, I\'d rather be sentenced to a month of watching \'Rhoda\' than endure a single episode of this drivel, which makes me ashamed to be British.'
72,0,b"No one in this movie has very much to do. This is probably the longest 65 minutes I've ever spent watching a movie. The makeup effects on the pianist with macromeglia are pretty good, but that's the only thing that keeps this from being rate a 1. The doctor's assistant goes through extreme mood swings from passivity to hysteria in seconds and then seems to forget where she was in the next scene. The director assembled a lot of the right ingredients for a mad-doctor movie, but somehow forgot the skeleton of a story to hang them on. Unless you know someone in the cast or crew, I wouldn't recommend even sampling this one."
73,0,b'I grew up watching the "Bowery Boys" on the weekends and even at young an age I could tell this was low rent stuff as the name implies. Still it was fun to watch Satch (Hall) get the better of Muggs (Gorcey) after Muggs would beat the crap out him. The East Side Kids stuff were never shown even though it was public domain stuff and probably cheap to run, it was just to low a standard for kids to tune in even though we only had like 5 channels to watch. Enter the year 2005 and I am repossesin about my childhood. I can\'t find any Bowery Boys on DVD but I found The East Side Kids on disc and also on a public domain website. Thankfully I saved my dough and saw Bowery Blitz on the web for free, and it really really blows. Now I can see there are some Bowery Boys and maybe Monogram bad movie lovers here that gave this melodrama crap a 7 of 10 but c\'mon folks, this ain\'t even trying to be funny. It\'s an East Side Kids drama, not a comedy so it\'s no good. The best part was seeing Muggs fight at the end, he reminded me of my grade school days flayling away like a girl when I would get in a fight, it was kinda abusin. Leonard Maltin said in his mini bio that this flick is one of the better ones, so you can just imagine the rest. If you wanna see some halfway decent East Side action see Ghosts on The Loose maybe but the bottom line is usually a comedy team starts out strong in their career and tapers off, these mugs blew chucks early on then slowly picked it up until Hall\'s antics dominated than they were at best. Still 2nd tier stuff way below the 3 stooges, who they imitate but amusing for those who grew up with them. This feature won\'t bring back pleasant "Bowery Boys" memories and is best left to Monogram fanatics.'
74,0,b"The most enjoyable parts of this film were the clips from the original movie. The acting was poor and the premise of sexual scorecards was revolting. The effects were marginal at best. There were no stand out performances, Amy Irving was put in this film to try and get a part of the Halloween H20 audience. The original was much more enjoyable and gratifying. I am sorry to say that this is not going to be one of the years 10 best...so far it is at the bottom of my list. Don't bother with this one folks!!"
75,0,b"This is another one of those movies I just knew I would hate, but it ended up not being as bad as one would expect.<br /><br />It has a lot of T&A in it and even the DVD menu is chocked full of women's breast. The first few scenes of the movie has a lot of sex and nudity and I was beginning to think there would be no story at all just exploiting nudity for the sake of making money off a popular prequel 8MM.<br /><br />As I continued to watch there was just more sex and nudity and main characters that I could care less about, but then the story started to unfold and I started to see a point to it all, and it was a tad better.<br /><br />It is about a man who's fianc\xc3\xa9 is the daughter of an Ambasador and they all have a promising future until nude photos of a menage a trois sex act shows up and blackmail is in the senders cards. The man and his fianc\xc3\xa9 must now get to the bottom of who sent the pics and how to shut them up.<br /><br />The movie first of all is nothing to do with part 1, it doesn't even have anything to do with 8MM's, its about a sex video though so I can see the similarities, as small as they may be.<br /><br />The acting is neither good, nor bad, its just nobodies playing parts anybody could do. The films production value is middle of the road and its pure drama yawn.<br /><br />I did enjoy going along for the ride getting to the bottom of the blackmailers motives. I was anticipating answers which is way more than I could say for the first one which I consider garbage. This movie has some nice twists too which are always welcomed.<br /><br />It's not great, and it is very slow started, but it does ultimately entertain. I wasn't on the edge of my seat and I won't rave to my friends that this is a must see, but hey if you watch a lot of movies and always seek something new, this might entertain you for 90 minutes."
76,0,b'I just finished watching one episode(S1-#5 A boy in a bush), so maybe my review is not very fair.<br /><br />But based on that episode, this is a very poor version of CSI, the acting is crap. The main character, Dr whatever her name is, is so fake it actually hurts. I wouldn\'t cast her to do an add for dog food!<br /><br />The other hurtful thing is David Boreanaz of the "Angel" fame, a good actor, does a great job, but wasted coz of the idiotic acting of that woman.<br /><br />Supporting cast is OK, but all is ruined due to this stupid acting of Emily Deschanel .<br /><br />Very disappointing version of CSI, very sorry to see it appear on the filmography of some of the potential talents involved in it.<br /><br />That woman is really sh#t, at least in that episode. But based on this one view, I will not even invest watching it even if it was shown on an elevator screen.'
77,1,b'Joe is the movie about the dark side of the force of the 1960\'s in America, and Susan Sarandon had nice boobs. This movie scared me so much when I saw it in the theatre that I never liked Peter Boyle until Young Frankenstein and was still quite leery of him even after that comedy. Looking back now from today\'s experience, this film seems current again in being direct and to the point of half the electorate\'s approval of John McCain\'s "Joe The Plumber" typecast and their fear of electing a black man as President of the USA in the coming weeks. A black Prez would be seen as sweet revenge of the "niggers" but bound to again bring fire to many minds if not the streets, this time by Joe enthusiasts. So, the spirit of Joe in the film is resurrected in the campaign of Joe The Plumber! Still, I love to be American and be terrified at both and by the knowledge that they illustrate what ironically Gregory Peck said our civilized law also is: "a living, breathing reality!" God help us.'
78,1,b"A nice, humorous mix of music hall (in the first third mostly) and police procedural mystery as the various suspects' stories start to collapse. The final exposure of the murder may come as a surprise if you don't watch closely. A gritty look at Paris of the time. You can ignore the final scene (the Hollywood ending). Louis Jouvet is best as the police inspector who seems to be just passing through, but is really on top of things."
79,1,b'This was one of the few shows that my wife and I agreed on watching. I was upset to hear that it was canceled, especially because I didn\'t realize the ratings were so poor. As far as I knew it was doing very well with a lot of viewers. Almost all my friends and most of the people I spoke to watched the show. Now we are stuck watching either crappy shows or DVD\'s. How bad was the show doing? does anyone know the real results of the shows viewings? I know that when it went to Thursdays, it was more difficult for me to catch. Thank G*d for DVR\'s! <br /><br />Anyways, this was a real surprise to know that there will be no more "The War At Home". If any other networks see this, PLEASE PICK UP THE SHOW!!!! PLEASE!'
80,0,b"Can they possibly get any worse than this? Probably. But after all Steven Seagal gets to do what he does. Well kind of; this time instead of mortally wounding the bad guys he just wounds them. By reputation of being a bad ass agent Seagal is hired to deliver a special package from France to America. But it is not an easy task with so many people trying to intercept and foul up the mission. The fights just don't have enough bite and the big bangs are just big and that's all. Anna-Louis Plowman seems to be the only cast member not to appear wooden. Also in the cast are: Jeffery Pierce, Max Ryan and Harry Van Gorkum. Don't put all the blame on Seagal for this clunker."
81,0,b'Henry (Don Ameche) turns up at the entrance to Hell and recounts his life story to His Excellency (Laird Cregar). The story focuses on his relationships with females throughout his life, and in particular, his relationship with Martha (Gene Tierney). At the end of the film, we cut back to Henry and His Excellency for a very predictable ending.<br /><br />Unfortunately, there is nothing more to say about the film because nothing happens. Its a sentimental story of one man\'s life and its very boring. I watched it with my girlfriend and my dad and we all thought it was rubbish, despite the Lubitsch touch. I yawned more than 15 times. Hugo (Charles Coburn) is good whenever he is on screen as the grandfather and there were a few funny moments of dialogue. The colour made it a good spectacle but it wasn\'t enough to save this plodder from going into the reject pile. In the same mould as "Its A Wonderful World" and "You Can\'t Take It With You", and so, not surprisingly, it was nominated for an Oscar. A story about ordinary people, none of whom are interesting and with no storyline of any interest. Boring, sentimental and the biggest damp squib of an ending that I can remember...'
82,1,b'I remember watching this movie when it came out as a t.v. movie of the week in the early 1970\'s.<br /><br />Although I haven\'t seen this movie in over 30 years I remember how creepy it was...the sister\'s dead body in the basement, the storm raging outside, the creepy house with no electricity and a killer still on the premises.<br /><br />They just don\'t make t.v. movies like this one anymore. Elizabeth Montgomery was a very underrated actress and I liked her in not only "Betwitched", but several of her post-Bewitched roles, such as this one and 1975\'s "The Legend of Lizzie Borden".<br /><br />I really wish that someone would come out with a DVD that has several of the 1970\'s t.v. movie of the week on one DVD. Wouldn\'t it be awesome to watch "When Michael Calls", "Bad Ronald", "Don\'t Be Afraid of the Dark", "Crowhaven Farm", etc., all on one DVD? I know there is a market for a DVD like this for all of us baby boomers who grew up in the 1960\'s and 1970\'s. Maybe, if we are lucky, someday someone will offer us a DVD with a great selection of t.v. movies like this.'
83,1,b'Three children are born at the exact same time,during a lunar eclipse.Just before their 10th birthday they embark on a killing spree."Bloody Birthday" is a typical slasher from early 80\'s.It\'s a pretty average stuff with plenty of nudity.The evil children never generate any menace and there is almost no suspense.There is also no gore or scares in "Bloody Birthday",but the film is mildly entertaining.Unfortunately no real explanation is provided for the kids sudden homicidal mania.The murder scenes are quite gruesome for example we\'ve got death by handgun,baseball bat,skipping rope and shovel.So if you\'re a fan of early 80\'s slasher movies give this one a look.'
84,1,b"Beyond the Clouds is in many ways the weirdest film I have ever seen. Not for its Cult appeal, gore, or even for its ideas, but because of the elements that combine to make this a masterpiece of cinema. Beyond the Clouds was directed by Michelangelo Antonioni, one of Italy's most famous directors. However, if you gave this film only a quick watch-over, passively I mean, it would seem one of those melodramatic and often pointless romances. This movie deserves great attention, to the point of embracing all its cheese. By cheese I don't mean a slice, but a whole brick of cheddar! The music seems like it's from some Italian porno, the story and dialogue like they are from a corny Japanese soap, and the metaphors are so obvious you want to smack yourself on the head.<br /><br />But once you get passed all this, you are engaged in an existential work of art. The cheese feeds into the subtle filming and draws our attention, perfectly, to what needs to be known. The basic plot is of four chapters, unrelated, and all about love. What we learn is that no matter what happens or what is said, people cannot communicate to each other. Instead they can only communicate through each other. I suppose that's why the dialogue and plot is so cheesy, because the conversations are overly irrational with lack of causality and people's reaction overly melodramatic.<br /><br />I left that film thinking to myself; maybe all life is one big melodrama. We judge our feelings towards others as real and purposeful. I hate, because I have reason. But what does the hated think? Maybe they think that my hate is stupid and arbitrary. In other words, melodramatic.<br /><br />So melodrama is actually an existential function. A corny romance is simply human interaction put under a magnifying glass, allowing us to see the futility of who we are and what we do.<br /><br />This is a great film, I recommend it to all!"
85,0,b'Leslie Nielsen is usually someone whose movies I really like (even critically panned flicks like "Dracula: Dead and Loving It" and "Wrongfully Accused"). So the fact that I\'m slamming "Mr. Magoo" should show that it\'s a piece of junk. It casts Nielsen as the myopic title character, something gets planted on him, and he makes a mess of everything. It seems like the combo of Nielsen and director Stanley Tong (behind two of Jackie Chan\'s movies) would make this one hilarious movie, but it doesn\'t; it seems like they just have people to do anything, and there\'s no real humor here.<br /><br />So, the original cartoon with Jim Backus providing the voice was worth seeing, so avoid this movie. Leslie Nielsen has also done much better, so there\'s no reason to waste your time on this. Also starring Kelly Lynch, Stephen Tobolowsky, Ernie Hudson, Malcolm McDowell and Miguel Ferrer; they probably don\'t wish to emphasize this hunk of junk in their careers.'
86,0,b'I happened to catch this on TV, and wanted to watch because I remembered the Spin magazine article upon which the movie is based. I was very disappointed. First, if James Belushi is the lead actor in a movie, it should be a sign that it\'s not exactly an A-list production. Gregory Hines was a world class dancer, but sadly not a great actor.<br /><br />In fact, all of the acting in this film is either flat or hammy, which can only be blamed on the director, who is this film\'s weakest link. Charles Carner seemed to be trying to ape Oliver Stone\'s "JFK" in portraying the alleged conspiracy to cover up the "real" child murderer(s), but without the benefit of a good script, an A-list cast or, it must be said, the talent. It just doesn\'t work.<br /><br />It\'s a shame that such a worthy topic for a film did not get better treatment.'
87,0,b'Greetings All,<br /><br />Isn\'t it amazing the power that films have on you after the 1st viewing ?<br /><br />I was so delighted by the first viewing of this film, I couldn\'t stop talking about "Flatliners" to all my friends for weeks - mind you I was a very impressionable 18 year old back then and my taste in films have become a little more conservative since then.<br /><br />Then somehow I forgot about this film until I saw the DVD in my local department store and remembering how great it was I thought "Right ! I\'ll pluck you off the shelf when they bring out the Special Edition".<br /><br />Last week, I was overjoyed when my best friend invited me over to watch Flatliners on DVD. The expectation was that I would love this film even more on 2nd viewing.. How wrong I was !<br /><br />Verdict: after 11 years my view on this film had changed from a very scary 1st class movie to total junk which overplays on the religious and supernatural side of things ratherly superficially.<br /><br />I have never been a big fan of Julia Roberts\' acting (excepting for Erin Brockeridge in which she deserved her Oscar) I think the problem with this film definitely lies with the director and a so so mediocre script. I left this film feeling it had no real substance or potential, and just a couple of scarey cheap thrills which weren\'t very well done at all. Not even the score by James-Newtown Howard, who I rather like as a film composer, could captivate and thrill me.<br /><br />In 1990 I would have given this film 9.5 / 10; but in 2001 I\'d be lucky to give it 2 / 10 at best.<br /><br />'
88,0,b'OK, so this film is well acted. It has good direction but the simple fact is that it undermines what all gay and lesbian people have been fighting for all these years. The straight man "deciding to be gay" and the gay man "Deciding to be straight" I did enjoy it up until the last 20 minutes, after that i got really offended. As what usually happens in these films the straight actors play the main parts and the out gay actors play the secondary straight roles. The leads are played by handsome men but don\'t let that distract you from the fact that this is a a film that leaves you feeling unfulfilled. All the romance and relationships you hope would happen do not. Unless you are a priest that is in which case god bless straight woman who cure our homos.'
89,0,b"I liked most of this film. As other reviews mentioned it has a good cast, the plot is interesting enough. All in all it is fun to watch.<br /><br />But the ending, I feel, is completely botched, it left me bewildered. Yes, you expect people crossing and double-crossing each other in this sort of movie, but quadruple-crossing? Well, if it's justified by the plot then why not? <br /><br />But that's the bad part, there's completely no need for it. After a certain point it's all scheming with completely no meaning. (here comes the SPOILER). After the airport scene Enrico and his accomplices already HAVE the money. I couldn't understand the need for the rest of the scam. Is it all necessary just to rub Federico's nose in the fact that he's been fooled? I don't buy it.<br /><br />So 6 out of 10 for 3/4 of the film and 2 out of 10 for the ending."
