1,1,b"There are films that make careers. For George Romero, it was NIGHT OF THE LIVING DEAD; for Kevin Smith, CLERKS; for Robert Rodriguez, EL MARIACHI. Add to that list Onur Tukel's absolutely amazing DING-A-LING-LESS. Flawless film-making, and as assured and as professional as any of the aforementioned movies. I haven't laughed this hard since I saw THE FULL MONTY. (And, even then, I don't think I laughed quite this hard... So to speak.) Tukel's talent is considerable: DING-A-LING-LESS is so chock full of double entendres that one would have to sit down with a copy of this script and do a line-by-line examination of it to fully appreciate the, uh, breadth and width of it. Every shot is beautifully composed (a clear sign of a sure-handed director), and the performances all around are solid (there's none of the over-the-top scenery chewing one might've expected from a film like this). DING-A-LING-LESS is a film whose time has come."
2,1,b"A blackly comic tale of a down-trodden priest, Nazarin showcases the economy that Luis Bunuel was able to achieve in being able to tell a deeply humanist fable with a minimum of fuss. As an output from his Mexican era of film making, it was an invaluable talent to possess, with little money and extremely tight schedules. Nazarin, however, surpasses many of Bunuel's previous Mexican films in terms of the acting (Francisco Rabal is excellent), narrative and theme.<br /><br />The theme, interestingly, is something that was explored again in Viridiana, made three years later in Spain. It concerns the individual's struggle for humanity and altruism amongst a society that rejects any notion of virtue. Father Nazarin, however, is portrayed more sympathetically than Sister Viridiana. Whereas the latter seems to choose charity because she wishes to atone for her (perceived) sins, Nazarin's whole existence and reason for being seems to be to help others, whether they (or we) like it or not. The film's last scenes, in which he casts doubt on his behaviour and, in a split second, has to choose between the life he has been leading or the conventional life that is expected of a priest, are so emotional because they concern his moral integrity and we are never quite sure whether it remains intact or not.<br /><br />This is a remarkable film and I would urge anyone interested in classic cinema to seek it out. It is one of Bunuel's most moving films, and encapsulates many of his obsessions: frustrated desire, mad love, religious hypocrisy etc. In my view 'Nazarin' is second only to 'The Exterminating Angel', in terms of his Mexican movies, and is certainly near the top of the list of Bunuel's total filmic output."
3,0,b'Scary Movie 1-4, Epic Movie, Date Movie, Meet the Spartans, Not another Teen Movie and Another Gay Movie. Making "Superhero Movie" the eleventh in a series that single handily ruined the parody genre. Now I\'ll admit it I have a soft spot for classics such as Airplane and The Naked Gun but you know you\'ve milked a franchise so bad when you can see the gags a mile off. In fact the only thing that might really temp you into going to see this disaster is the incredibly funny but massive sell-out Leslie Neilson.<br /><br />You can tell he needs the money, wither that or he intends to go down with the ship like a good Capitan would. In no way is he bringing down this genre but hell he\'s not helping it. But if I feel sorry for anybody in this film its decent actor Drake Bell who is put through an immense amount of embarrassment. The people who are put through the largest amount of torture by far however is the audience forced to sit through 90 minutes of laughless bile no funnier than herpes.<br /><br />After spoofing disaster films in Airplane!, police shows in The Naked Gun, and Hollywood horrors in Scary Movie 3 and 4, producer David Zucker sets his satirical sights on the superhero genre with this anarchic comedy lampooning everything from Spider-Man to X-Men and Superman Returns.<br /><br />Shortly after being bitten by a genetically altered dragonfly, high-school outcast Rick Riker (Drake Bell) begins to experience a startling transformation. Now Rick\'s skin is as strong as steel, and he possesses the strength of ten men. Determined to use his newfound powers to fight crime, Rick creates a special costume and assumes the identity of The Dragonfly -- a fearless crime fighter dedicated to keeping the streets safe for law-abiding citizens.<br /><br />But every superhero needs a nemesis, and after Lou Landers (Christopher McDonald) is caught in the middle of an experiment gone horribly awry, he develops the power to leech the life force out of anyone he meets and becomes the villainous Hourglass. Intent on achieving immortality, the Hourglass attempts to gather as much life force as possible as the noble Dragonfly sets out to take down his archenemy and realize his destiny as a true hero. Craig Mazin writes and directs this low-flying spoof.<br /><br />featuring Tracy Morgan, Pamela Anderson, Leslie Nielsen, Marion Ross, Jeffrey Tambor, and Regina Hall.<br /><br />Hell Superhero Movie may earn some merit in the fact that it\'s a hell of a lot better than Meet the Spartans and Epic Movie. But with great responsibility comes one of the worst outings of 2008 to date. Laughless but a little less irritating than Meet the Spartans. And in the same sense much more forgettable than meet the Spartans. But maybe that\'s a good reason. There are still some of us trying to scrape away the stain that was Meet the Spartans from our memory.<br /><br />My final verdict? Avoid, unless you\'re one of thoses people who enjoy such car crash cinema. As bad as Date Movie and Scary Movie 2 but not quite as bad as Meet the Spartans or Epic Movie. Super Villain.'
4,0,b'Poor Shirley MacLaine tries hard to lend some gravitas to this mawkish, gag-inducing "feel-good" movie, but she\'s trampled by the run-away sentimentality of a film that\'s not the least bit grounded in reality.<br /><br />This was directed by Curtis Hanson? Did he have a lobotomy since we last heard from him? Hanson can do effective drama sprinkled with comedy, as evidenced by "Wonder Boys." So I don\'t know what happened to him here. This is the kind of movie that doesn\'t want to accept that life is messy and fussy, and that neat, tidy endings (however implausible they might be) might make for a nice closing shot, but come across as utterly phony if the people watching the film have been through anything remotely like what the characters in the film go through.<br /><br />My wife and I made a game of calling out the plot points before they occurred -- e.g. "the old man\'s going to teach her to read and then drop dead." Bingo! This is one of those movies where the characters give little speeches summarizing their emotional problems, making you wonder why they still have emotional problems if they\'re that aware of what\'s causing them. Toni Collette (a fine actress, by the way, and one of my favorites if not given a lot to work with here), gives a speech early on about why she buys so many shoes and never wears them, spelling out in flashing neon the film\'s awkward connecting motif. At that moment, I knew what I was in for, and the film was a downward spiral from there.<br /><br />Grade: C-'
5,1,b'As a former Erasmus student I enjoyed this film very much. It was so realistic and funny. It really picked up the spirit that exists among Erasmus students. I hope, many other students will follow this experience, too. However, I wonder if this movie is all that interesting to watch for people with no international experience. But at least one of my friends who has never gone on Erasmus also enjoyed it very much. I give it 9 out of 10.'
6,1,b"My God, Ryan Gosling has made a lot of deep characters in his career, this is one of his wonderful acting jobs. For me this is a very deep movie, needs a lot of concentration, not because is difficult to watch, just because you understand it if you put your shoes in this kid, even though has everything and has famous father that is a writer, has a deeper mind, you don't understand why he kills this poor kid, until you really heard what he has to say and you start to think, at least to me, that a lot of things that he says is true. Simple kid, sweet, very gentle, in a way normal like any teenage, but inside of him suffer because he start to look at the world in a different way, then you understand why he did what he did. I recommend this movie for those who likes deep drama."
7,1,b"This film just won the best film award at the Cleveland International Film Festival. It's American title apparently is Autumn Spring. The acting is superb. The story takes you into the life of an elderly man who takes what life deals him and spikes it up a little bit. Abetted by his best friend (and partner in not-so-serious crime) he puts people on at every opportunity but still often reveals his heart of gold. His longsuffering wife has come to her wits end and makes a life-changing decision which is heartbreaking to watch. The resolution of the story is beautiful."
8,1,b'The cast for this production of Rigoletto is excellent. Edita Gruberova sings Gilda magnificently and passionately. Luciano Pavarotti also sings splendidly. Vergara is a fine Maddalena; Fedora Barbieri is a famous older singer who sings the maid, Giovanna. Weikl sings Marullo; Wixell sings both Rigoletto and Monterone. As Rigoletto, Wixell is probably the most convincing acting singer in this hard-to-beat ensemble of great singers. Kathleen Kuhlmann in the Contessa. All principals are well-known and world-renowned.<br /><br />This is an exciting Rigoletto visually as well as musically.<br /><br />I have it on both laser disc and DVD. You should have it too!'
9,0,b'As long as you keep in mind that the production of this movie was a copyright ploy, and not intended as a serious release, it is actually surprising how not absolutely horrible it is. I even liked the theme music.<br /><br />And if ever a flick cried out for a treatment by Joel (or Mike) and the MST3K Bots, this is it! Watch this with a bunch of smart-ass wise-crackers, and you\'re in for a good time. Have a brew, butter up some large pretzels, and enjoy.<br /><br />Of course, obtaining a copy requires buying a bootleg or downloading it as shareware, but if you\'re here on the IMDb, then you\'re most likely savvy enough to do so. Good luck.<br /><br />And look for my favorite part....where Dr. Doom informs the FF that they have 12 hours to comply with his wishes....and he actually gestures the number "12" with his finger while doing so....it\'s like "Evil Sesame Street"....hoo boy.<br /><br />...and of course Mrs. Storm declaring "Just look at you....the Fanstastic Four" is just so heartwarming....you\'ll laugh, you\'ll cry.....<br /><br />So if you love schlocky Sci-Fi, this one\'s Fantastic For you!'
10,1,b"Every great once in a while, you stumble upon a movie that exceeds even your wildest expectations. Given the IMDb rating of 4.0, I wasn't really expecting much with The Brotherhood of Satan. I hoped that at a minimum it might be cheesy fun like The Devil's Rain or any of the other early 70s similarly themed Satanic horror films. I couldn't' have been more wrong. What I got instead was an ambitious and intelligent film with a cast I really enjoyed. Speaking in broad terms to avoid giving anything away, the film's style and structure are much more experimental than the straightforward storytelling so prominent in the early 70s. The Brotherhood of Satan doesn't beat you over the head with plot points and explanations. A lot is left to the viewer to fill in the blanks. As a viewer, you know something is amiss, but for the longest period you're just not sure what it is. The unknown helps make for a far creepier atmosphere than most similar films. The ending is effective with its surreal imagery. I sat in amazement as the final credits began to roll. Those wanting a big slam-bang finale will be disappointed with the ending's simplicity. A lesser film would have tried to pull out all the stops and would, most likely, have failed miserably.<br /><br />There are moments in the film where it's easy to forget the director, Bernard McEveety, had primarily worked in television before The Brotherhood of Satan. There are a few scenes that are so well set-up, lit, and shot that even the most accomplished of directors could learn a thing or two. For example, I've seen enough films over the years to realize that directors can sometimes seem to have trouble shooting widescreen shots indoors. Not here. The scene where the men are discussing their plan of action in the sheriff's office is amazing. We see all five men at once \xc2\x96 each doing their own thing as in real life. In a lesser film, we might see all the men at once, but each would be motionless, quietly waiting their turn to deliver their dialogue. It's a small scene, but it looks so natural and is so beautifully shot that it's one of my favorite moments of The Brotherhood of Satan.<br /><br />Finally, I mentioned the acting in my opening, so without going into a long-winded speech, I'll just say that The Brotherhood of Satan features Strother Martin and L.Q. Jones. Any film with these two guys is almost an automatic winner with me."
11,0,b'I\'ll give it a two because it has a lot of music, otherwise it would be a one.<br /><br />I saw this movie for the first time tonight and it\'s the first "Road" picture I\'ve seen. I was expecting waaaaay better. Robert Osborn says this is the best of the Road movies. If that\'s true I needn\'t bother to see the others. The best thing about this movie is that it has a lot of songs in the first half, but that\'s balanced out by only one production number with dancing in the entire movie.<br /><br />I didn\'t like the movie. Neither Hope nor Crosby came across all that well, their characters weren\'t very charming, the movie was not funny at all, most of the dialog was just lame filler, there wasn\'t much action, there wasn\'t much spectacle.<br /><br />The movie wasn\'t what I expected. I was expecting more "Road," but there isn\'t much. They quickly make it to the palace and then most of the movie takes place there, until the end. I was also expecting a lot more of the famous "road" style of breaking the fourth wall, wherein the characters talk directly to the audience or comment on the plot. There was only about 4 instances of that. One of those is an example of the non-funny humor of this script:<br /><br />(Hope recaps the plot up to now to Crosby) Crosby: I know all that! Hope: Yeah but the people that came in half-way through the picture don\'t. Crosby: You mean they missed my song?<br /><br />Those are two weak punchlines, but at least they are actually jokes. Much of the rest of the script doesn\'t even have any jokes. An example is: <br /><br />Crosby: Remind me to throw you a piece of cheese in the morning. (Indirectly calling Hope a rat).<br /><br />That\'s not funny at all, it barely even qualifies as a joke, but that\'s the kind of non-joke dialog that carries most of the movie. Many of the scenes don\'t even come that close to a joke, just using generic uninteresting dialog like:<br /><br />Crosby: Hey, whadda ya\' take me for? You think that you can just throw me to the dogs? Hope: Well why not, you did it to me didn\'t you? Crosby: Yeah but that\'s because I was lookin\' out for us. You\'re not lookin\' out for nobody. Hope: Oh yeah? Well then why did I pay the check?<br /><br />(the above is just from my memory. It\'s not exact but it illustrates to you what I mean).<br /><br />And so on....just generic dialog with no jokes at all.<br /><br />My grade: A waste of time.'
12,0,b"I kind of like Bam Margera, so I was curious. <br /><br />But watching a home production with somebody elses friends and family, with a decent camera and a sound guy, just isn't good film-making. <br /><br />Writing, direction, acting and editing is abysmal at best. But I sat through half of it. And why?<br /><br />This film gives perfect examples of what not to do, it is a film student's dream of what to avoid at every stage of the process. Cram it into film school curiculums all over the joint!<br /><br />So thanx Bam! Now I know Jackass is for real - cause you ain't looking to win an Oscar, dude:)"
13,1,b'The plot line is an expose of the under belly of American politics. While the theme seems common, what "makes" the movie is the unconventional way the story is told.<br /><br />The characters are played with conviction. You feel the innocence of the lead, and his innocence lost. The politician is the prince of double-talk, a real snake.<br /><br />The camera work is impressive. It affirms the nuances of the acting and dialogue. Ditto for the music.<br /><br />The story uses a parable-style with vingettes where the message is filled with double-entendres. A very canny strategy by the writer/director. The tension in the storyline is carried through to the last scenes.<br /><br />The movie was like a good mystery book. Something was "afoot"; you knew it was bad; you didn\'t know exactly what it could be - you had your suspicions; and when the evil was revealed you let out your breath you hadn\'t noticed you were holding in. Saddened, shaking your head.<br /><br />A story well written and well told. 3 cheers to a young writer/director.'
14,0,b'I saw this movie as part of a Billy Graham program. The church I attend was part of a community wide outreach to present God and Christianity to our community (Hartford, Ct. USA). I was one of the counselors who helped attendees (who were invited to come forward and make whatever kind of religious profession they wanted...and to follow up on them after the movie. As such, it did what it was supposed to do, and I personally found it to be a medium to strengthen my faith in God.I also found it to be very helpful to those I counseled. I especially like the work of Kim Darby in this movie. And the parents (the Wintons?) were , in a way, a little overdrawn....no one says to their child if they think that he or she may be the parent of an illegitimate child something like the Wintons did "oh, no, no, not thaaat." That isn\'t exactly what they said, but the sympaathetic audience I saw had a laugh at whatever it was they did say, and also at the son\'s emphatic "No, MOm, not me." Don Berghuis'
15,1,b"Anything Park Chan-wook creates is guaranteed to be unique, brilliant, and very twisted at a minimum. Well, anything that isn't I'm a Cyborg at least. Park's newest film titled Thirst is a vampire romance-erotic-thriller-dark comedy-drama \xc2\x96 yes, that is a lot of adjectives \xc2\x97 inspired by the 19th century French novel by Emile Zola titled Therese Raquin. Park creates a uniquely Korean, and uniquely Park, vision of the vampire mythos and asks the audience to explore the dilemma of a Catholic priest discovering himself having a thirst for blood and the moral and spiritual crisis that would develop. Park delivers on the elements you would hope but definitely falls short of masterpiece quality like Oldboy or even that of Lady Vengeance. Heavily bloated with a narrative that often loses itself much less the audience, Thirst desperately needed another trip through the cutting room. It crawls when it should be running but luckily brings it back home before losing the audience completely. As negative as it may sound the positives definitely outweigh the negatives and another volume has without a doubt been added to the dark and twisted Zeitgeist of Park Chan-wook film.<br /><br />Check out the rest of our review at www.thefilmstage.com"
16,0,b'This film did well at the box office, and the producers of this mess thought the stars had such good chemistry in this that they cast them in the much darker screwball farce, The Gazebo. Frankly, I am shocked to see all the positive comments on this ludicrously plotted unfunny comedy. Both lead characters have the maturity of seven-year-olds and are much less interesting to spend time with. A veteran supporting cast including Fred Clark, Harry Morgan, and Eva Gabor lend excellent support. And, the beautiful cinematography certainly makes the rich countryside of Spain seem lush. And, there are four or five truly funny scenes to go with two wise scenes and a whole bunch of recycled and unfunny clutter.<br /><br />I cannot recommend It Started With A Kiss.'
17,1,b'I own a Video store with hundreds of documentaries. I have seen loads of them and love all of the great info out there. Only a small handful though even come close to offering info as important as this one. I have been reading through other peoples reviews of this film and can\'t help but notice that the main things people are criticizing are irrelevant. Such as "It is very one sided" Such a pathetic criticism, every where in society that you look you will see the other side, and if you still need help go to globalpublicmedia.com. "It is the same people over and over" Uh one might be led to believe that these people are the experts, so maybe they are the best people to interview. "filming style is all the same, head shots with few exceptions" If you want flash and dazzle watch Micheal Moore if you want info watch real docs such as this one. As you can plainly see none of these complaints have any relevance to the information contained. My guess is that these people are just missing the point and don\'t wanna give up there SUV\'s.<br /><br />My recommendation: Watch it. Learn from it, and continue your education about such subjects. It is very important stuff for EVERYONE.'
18,0,b"The dog can act...unfortunately nobody else in the cast of this sordid faux children's film can. A stray yet very clever dog insinuates himself into the lives of two motherless children, much to the chagrin of their bitter and cold-hearted father. In what can only be described as Dickensian, the evil widower forbids his children --- who may or may not be mentally challenged --- from playing with Benji. Neither the children nor Benji obeys. Soon the children are kidnapped and Benji has to help the police find them. It's only then that the old man realizes that Benji is good, not bad.<br /><br />Tom Lester, whose only previous acting experience appears to have been playing the dim-witted Eb on GREEN ACRES plays one of the kidnappers. So does the regrettably over-utilized Deborah Walley. Walley's previous screen triumphs include BEACH BLANKET BINGO and the woeful IT'S A BIKINI WORLD. She also played both Gidget and Tammy in the past and here attempts to obliterate her good-girl reputation by playing it bad! <br /><br />STAY away from BENJI...he's a dog and this movie is a dog!"
19,1,b'Sergei Eisenstein\'s most famous movie has truly withstood the test of time. The story of a mutiny aboard a warship in 1905 does have the feeling of Soviet propaganda, but does a good job showing the conditions that led to the revolt. The scene on the Odessa steps should remain seared into anyone\'s mind.<br /><br />Okay, so "The Battleship Potemkin" wasn\'t actually the first movie to use montage, but they did a great job with it here. Certainly any film history class should show this movie. It\'s a great historical drama (although I will admit that I don\'t know how accurate it is). A 10/10.<br /><br />Oh, and we should have learned by now that "Potemkin" should be transliterated as "Potyomkin".'
20,0,b"One would think that since this film has a bad rep that I would be exaggerating when I say I hated this film.But I'm am serious this movie was just so stupid and so unfunny, and such a waste of time.I mean after the first 30, I had a major headache and the smile I had on my face(that was mostly getting ready to laugh) was wearing off.When this film was over I was so glad and because I had good expectations that it would be funny I was extremely disappointed.The acting is not great, the comedy moments are lame and unfunny.Hardly anything is good about this, because I laughed at like maybe 2 parts.Overall this is so boring and I can't tell you how awful this is, I think this could be used as a suicide technique.I mean I don't think for some its even watchable.So my final words on this are, AVOID AT ALL COSTS."
21,0,b"I really tried, but this movie just didn't work for me. The action scenes were dull, the acting was surprisingly poor, and some of these characters were TOO stereotypical to even be funny. Pam Grier tries, but when you have nothing to work with, even her considerable talent cannot prevent a disaster. Even by the standards of this weak genre, this film is pretty bad."
